{
  "task_id": "live_7",
  "feature_request": "clear banking.py",
  "acceptance_criteria": [
    "A human developer must clarify the intended scope of 'clear",
    "It is unclear if 'clear' means delete, empty, or refactor",
    "Specific code definitions or files are missing from the request",
    "Human clarification is needed before generating testable metrics",
    "All existing tests pass"
  ],
  "scoped_files": [
    "banking.py"
  ],
  "status": "blocked",
  "current_agent": "manager_agent",
  "plan": "CANNOT PROCESS: Feature request requires human clarification. The instruction to 'clear banking.py' is ambiguous (e.g., delete vs. empty). Please specify required actions.",
  "history": [
    {
      "agent": "pm_agent",
      "output_summary": "acceptance criteria defined (5 criteria)",
      "timestamp": "2026-09-09T11:20:35.023964+00:00",
      "success": true
    },
    {
      "agent": "architect_agent",
      "output_summary": "plan written, 1 files scoped",
      "timestamp": "2026-09-09T11:20:35.279499+00:00",
      "success": true
    },
    {
      "agent": "coding_agent",
      "output_summary": "runner error: Groq API returned empty content.",
      "timestamp": "2026-09-09T11:20:35.468523+00:00",
      "success": false
    }
  ],
  "code_diff": null,
  "test_results": null,
  "review_result": null,
  "retry_count": 0,
  "consensus_report": {
    "consensus_score_pct": 87.0,
    "confidence_level": "MODERATE_CONFIDENCE",
    "sub_scores": {
      "pm_architect_alignment": 98.0,
      "architect_coding_alignment": 80.0,
      "testing_alignment": 90.0,
      "review_rigor": 80.0
    },
    "is_unanimous": false
  }
}