{
  "task_id": "2",
  "feature_request": "create hellodhruv.py which prints hi j",
  "acceptance_criteria": [
    "File named hellodhruv.py exists",
    "Script prints 'hi j' to stdout",
    "Script exits with code 0",
    "Script contains no syntax errors",
    "All existing tests still pass"
  ],
  "scoped_files": [
    "hellodhruv.py"
  ],
  "status": "blocked",
  "current_agent": "manager_agent",
  "plan": "NEW FILE: hellodhruv.py\nCreate a new Python script named hellodhruv.py that prints 'hi j' to standard output and exits successfully.",
  "history": [
    {
      "agent": "pm_agent",
      "output_summary": "acceptance criteria defined (5 criteria)",
      "timestamp": "2026-09-09T10:45:31.321369+00:00",
      "success": true
    },
    {
      "agent": "architect_agent",
      "output_summary": "plan written, 1 files scoped",
      "timestamp": "2026-09-09T10:45:58.700111+00:00",
      "success": true
    },
    {
      "agent": "coding_agent",
      "output_summary": "runner error: Groq API call failed: Error code: 429 - {'error': {'message': \"Request too large for model `qwen/qwen3.8-27b` in organiz",
      "timestamp": "2026-09-09T10:45:58.767219+00:00",
      "success": false
    }
  ],
  "code_diff": null,
  "test_results": null,
  "review_result": null,
  "retry_count": 0,
  "consensus_report": {
    "consensus_score_pct": 87.0,
    "confidence_level": "MODERATE_CONFIDENCE",
    "sub_scores": {
      "pm_architect_alignment": 98.0,
      "architect_coding_alignment": 80.0,
      "testing_alignment": 90.0,
      "review_rigor": 80.0
    },
    "is_unanimous": false
  }
}