{
  "task_id": "task_90439e",
  "feature_request": "modify train.py process candidates feature in it modify the condition to >= 21 and instead of printing eligible print eligible for gf",
  "acceptance_criteria": [],
  "scoped_files": [],
  "status": "blocked",
  "current_agent": "human",
  "plan": null,
  "history": [
    {
      "agent": "pm_agent",
      "output_summary": "pm_agent error: watsonx API HTTP 403: {\"errors\":[{\"code\":\"token_quota_reached\",\"message\":\"Request of 1 token(s) from quota was rejected\"",
      "timestamp": "2026-09-05T07:09:47.996497+00:00",
      "success": false
    }
  ],
  "code_diff": null,
  "test_results": null,
  "review_result": null,
  "retry_count": 0,
  "consensus_report": {
    "consensus_score_pct": 83.8,
    "confidence_level": "MODERATE_CONFIDENCE",
    "sub_scores": {
      "pm_architect_alignment": 85.0,
      "architect_coding_alignment": 80.0,
      "testing_alignment": 90.0,
      "review_rigor": 80.0
    },
    "is_unanimous": false
  }
}