{
  "task_id": "task_6b1ac3",
  "feature_request": "Create a testing.py to create 2 calsses shape(inout is a string) and rectangle(2 integers, length and breadth), which inherits shape and prints the area, then runs the main method where the shape name and area are printed for a 6x14 rectangle",
  "acceptance_criteria": [
    "The file testing.py can be executed successfully without any syntax errors or runtime exceptions",
    "A class named Shape exists in testing.py and accepts a string input for the name attribute",
    "A class named Rectangle exists in testing.py, inherits from Shape, and accepts two integer arguments for length and breadth",
    "When a 6x14 Rectangle object is instantiated, the program prints the shape name 'rectangle' and the calculated area 84 to standard output",
    "All existing tests still pass"
  ],
  "scoped_files": [
    "testing.py"
  ],
  "status": "blocked",
  "current_agent": "manager_agent",
  "plan": "NEW FILE: testing.py - Create a new script defining Shape and Rectangle classes with a main method to demonstrate inheritance and area calculation for a 6x14 rectangle.",
  "history": [
    {
      "agent": "pm_agent",
      "output_summary": "acceptance criteria defined (5 criteria)",
      "timestamp": "2026-09-08T07:33:28.864761+00:00",
      "success": true
    },
    {
      "agent": "architect_agent",
      "output_summary": "plan written, 1 files scoped",
      "timestamp": "2026-09-08T07:33:29.684651+00:00",
      "success": true
    },
    {
      "agent": "architect_agent",
      "output_summary": "NEW FILE declaration missing from scoped_files: testing.py - Create a new script defining Shape and Rectangle classes with a main method to demonstrate inheritance and area calculation for a 6x14 rectangle.",
      "timestamp": "2026-09-08T07:33:29Z",
      "success": false
    },
    {
      "agent": "coding_agent",
      "output_summary": "execution blocked before coding \u2014 NEW FILE declaration missing from scoped_files: testing.py - Create a new script defining Shape and Rectangle classes with a main method to demonstrate inheritance and area calculation for a 6x14 rectangle.",
      "timestamp": "2026-09-08T07:33:29Z",
      "success": null
    }
  ],
  "code_diff": null,
  "test_results": null,
  "review_result": null,
  "retry_count": 0,
  "consensus_report": {
    "consensus_score_pct": 87.0,
    "confidence_level": "MODERATE_CONFIDENCE",
    "sub_scores": {
      "pm_architect_alignment": 98.0,
      "architect_coding_alignment": 80.0,
      "testing_alignment": 90.0,
      "review_rigor": 80.0
    },
    "is_unanimous": false
  }
}