{
  "task_id": "task_91f953",
  "feature_request": "modify train.py for printing eligible if a candidate is above 18 otherwise reject",
  "acceptance_criteria": [
    "For a candidate with age 20, the printed output must be 'eligible'",
    "For a candidate with age 17, the printed output must be 'reject'",
    "If the input dataset is empty, the script must print 'no candidates'",
    "Accessing train.py without proper read permission must return HTTP status code 401 (Unauthorized)",
    "All existing tests still pass"
  ],
  "scoped_files": [],
  "status": "blocked",
  "current_agent": "human",
  "plan": null,
  "history": [
    {
      "agent": "pm_agent",
      "output_summary": "acceptance criteria defined (5 criteria)",
      "timestamp": "2026-09-05T06:01:39.740276+00:00",
      "success": true
    },
    {
      "agent": "architect_agent",
      "output_summary": "architect_agent error: Architect output validation failed: NEW FILE 'only if they do not already exist; in this case no new files are required'",
      "timestamp": "2026-09-05T06:01:43.628183+00:00",
      "success": false
    }
  ],
  "code_diff": null,
  "test_results": null,
  "review_result": null,
  "retry_count": 0,
  "consensus_report": {
    "consensus_score_pct": 72.5,
    "confidence_level": "REQUIRES_ATTENTION",
    "sub_scores": {
      "pm_architect_alignment": 40.0,
      "architect_coding_alignment": 80.0,
      "testing_alignment": 90.0,
      "review_rigor": 80.0
    },
    "is_unanimous": false
  }
}