{
  "task_id": "task_98e1ee",
  "feature_request": "Modify train.py for printing helllo world",
  "acceptance_criteria": [
    "When train.py is executed, it prints 'hello world' to stdout",
    "For an empty dataset, train.py prints 'no data provided' and exits with status code 0",
    "When an unauthorized user runs train.py, it denies execution and prints 'Permission denied' with status code 403",
    "All existing tests still pass"
  ],
  "scoped_files": [],
  "status": "blocked",
  "current_agent": "human",
  "plan": null,
  "history": [
    {
      "agent": "pm_agent",
      "output_summary": "acceptance criteria defined (4 criteria)",
      "timestamp": "2026-09-05T04:53:51.051815+00:00",
      "success": true
    },
    {
      "agent": "architect_agent",
      "output_summary": "architect_agent error: Architect output validation failed: scoped_files path 'NEW FILE:train_remote.py' does not exist on disk and is not marke",
      "timestamp": "2026-09-05T04:53:55.332379+00:00",
      "success": false
    }
  ],
  "code_diff": null,
  "test_results": null,
  "review_result": null,
  "retry_count": 0,
  "consensus_report": {
    "consensus_score_pct": 72.5,
    "confidence_level": "REQUIRES_ATTENTION",
    "sub_scores": {
      "pm_architect_alignment": 40.0,
      "architect_coding_alignment": 80.0,
      "testing_alignment": 90.0,
      "review_rigor": 80.0
    },
    "is_unanimous": false
  }
}