{
  "task_id": "task_eb7b5e",
  "feature_request": "Modify train.py for printing 'helllo world' in the first line it should allso ask the user for his age",
  "acceptance_criteria": [],
  "scoped_files": [],
  "status": "rejected",
  "current_agent": "human",
  "plan": null,
  "history": [
    {
      "agent": "pm_agent",
      "output_summary": "pm_agent error: watsonx API HTTP 429: {\"errors\":[{\"code\":\"consumption_limit_reached\",\"message\":\"The usage limit for the current plan has",
      "timestamp": "2026-09-05T05:03:21.723270+00:00",
      "success": false
    }
  ],
  "code_diff": null,
  "test_results": null,
  "review_result": null,
  "retry_count": 0,
  "consensus_report": {
    "consensus_score_pct": 83.8,
    "confidence_level": "MODERATE_CONFIDENCE",
    "sub_scores": {
      "pm_architect_alignment": 85.0,
      "architect_coding_alignment": 80.0,
      "testing_alignment": 90.0,
      "review_rigor": 80.0
    },
    "is_unanimous": false
  }
}