{
  "task_id": "task_577843",
  "feature_request": "Implement login rate limiting after 5 failed attempts",
  "acceptance_criteria": [
    "A user receiving their 6th failed login attempt within the enforcement period is denied access and the response payload includes an 'Account locked' or rate-limited specific error message",
    "Successful login attempts are allowed for a user who had exactly 4 previous failed attempts immediately prior",
    "The failure count is scoped to the specific account attempting login, as distinct IP addresses using the same credentials share the same attempt counter",
    "The failed attempt counter resets to zero when the user successfully logs in",
    "All existing tests still pass"
  ],
  "scoped_files": [],
  "status": "blocked",
  "current_agent": "human",
  "plan": null,
  "history": [
    {
      "agent": "pm_agent",
      "output_summary": "acceptance criteria defined (5 criteria)",
      "timestamp": "2026-09-07T17:57:12.363336+00:00",
      "success": true
    },
    {
      "agent": "architect_agent",
      "output_summary": "architect_agent error: Architect output validation failed: scoped_files path 'flaskbb/auth/rate_limiter.py' does not exist on disk and is not m",
      "timestamp": "2026-09-07T17:57:42.591569+00:00",
      "success": false
    }
  ],
  "code_diff": null,
  "test_results": null,
  "review_result": null,
  "retry_count": 0,
  "consensus_report": {
    "consensus_score_pct": 72.5,
    "confidence_level": "REQUIRES_ATTENTION",
    "sub_scores": {
      "pm_architect_alignment": 40.0,
      "architect_coding_alignment": 80.0,
      "testing_alignment": 90.0,
      "review_rigor": 80.0
    },
    "is_unanimous": false
  }
}