{
  "task_id": "task_93b6c8",
  "feature_request": "create a python file hello.py for printing hello srikar",
  "acceptance_criteria": [
    "Creates file named hello.py",
    "Prints exact string hello srikar",
    "Uses standard print function",
    "All existing tests still pass"
  ],
  "scoped_files": [
    "hello.py"
  ],
  "status": "approved",
  "current_agent": "review_agent",
  "plan": "Modify the existing file hello.py to contain a standard print statement that outputs the exact string 'hello srikar'.",
  "history": [
    {
      "agent": "pm_agent",
      "output_summary": "acceptance criteria defined (4 criteria)",
      "timestamp": "2026-09-09T16:54:36.742890+00:00",
      "success": true
    },
    {
      "agent": "architect_agent",
      "output_summary": "plan written, 1 files scoped",
      "timestamp": "2026-09-09T16:54:42.087341+00:00",
      "success": true
    },
    {
      "agent": "coding_agent",
      "output_summary": "code_diff generated for 1 file(s)",
      "timestamp": "2026-09-09T16:55:18Z",
      "success": true
    },
    {
      "agent": "testing_agent",
      "output_summary": "4/4 criteria matched; passed",
      "timestamp": "2026-09-09T16:55:25Z",
      "success": true
    },
    {
      "agent": "review_agent",
      "output_summary": "approved \u2014 no issues found",
      "timestamp": "2026-09-09T16:55:26.127780+00:00",
      "success": true
    }
  ],
  "code_diff": "--- a/hello.py\n+++ b/hello.py\n@@ -1,1 +1,1 @@\n print(\"hello srikar\")\n",
  "test_results": {
    "passed": true,
    "criteria_matched": [
      "Creates file named hello.py",
      "Prints exact string hello srikar",
      "Uses standard print function",
      "All existing tests still pass"
    ],
    "failures": []
  },
  "review_result": {
    "passed": true,
    "findings": []
  },
  "retry_count": 0,
  "consensus_report": {
    "consensus_score_pct": 97.1,
    "confidence_level": "HIGH_CONFIDENCE",
    "sub_scores": {
      "pm_architect_alignment": 98.0,
      "architect_coding_alignment": 96.5,
      "testing_alignment": 95.0,
      "review_rigor": 99.0
    },
    "is_unanimous": true
  }
}