{
  "task_id": "task_ddb05c",
  "feature_request": "create a file which imports iris dataset  and perform EDA on it python file",
  "acceptance_criteria": [],
  "scoped_files": [],
  "status": "blocked",
  "current_agent": "human",
  "plan": null,
  "history": [
    {
      "agent": "pm_agent",
      "output_summary": "pm_agent error: PM output failed validation \u2014 acceptance_criteria must be a list of 2\u20136 non-empty, non-duplicate strings. Got: [\"The Pyt",
      "timestamp": "2026-09-06T18:49:27.977380+00:00",
      "success": false
    }
  ],
  "code_diff": null,
  "test_results": null,
  "review_result": null,
  "retry_count": 0,
  "consensus_report": {
    "consensus_score_pct": 83.8,
    "confidence_level": "MODERATE_CONFIDENCE",
    "sub_scores": {
      "pm_architect_alignment": 85.0,
      "architect_coding_alignment": 80.0,
      "testing_alignment": 90.0,
      "review_rigor": 80.0
    },
    "is_unanimous": false
  }
}