{
  "task_id": "task_967a6b",
  "feature_request": "create a hi. Py file that prints hi",
  "acceptance_criteria": [
    "Creates file named hi.py in current directory.",
    "File contains valid Python syntax without errors.",
    "Executing file outputs exactly 'hi'.",
    "All existing tests still pass"
  ],
  "scoped_files": [
    "hi.py"
  ],
  "status": "approved",
  "current_agent": "review_agent",
  "plan": "NEW FILE: hi.py\n1. Create hi.py.\n2. Add Python code to print 'hi'.\n3. Validate the file compiles and outputs the expected string.",
  "history": [
    {
      "agent": "pm_agent",
      "output_summary": "acceptance criteria defined (4 criteria)",
      "timestamp": "2026-09-09T17:02:58.664211+00:00",
      "success": true
    },
    {
      "agent": "architect_agent",
      "output_summary": "plan written, 1 files scoped",
      "timestamp": "2026-09-09T17:02:58.969596+00:00",
      "success": true
    },
    {
      "agent": "coding_agent",
      "output_summary": "code_diff generated for 1 file(s) including 1 new file(s)",
      "timestamp": "2026-09-09T17:02:59Z",
      "success": true
    },
    {
      "agent": "testing_agent",
      "output_summary": "4/4 criteria matched; passed",
      "timestamp": "2026-09-09T17:03:02Z",
      "success": true
    },
    {
      "agent": "review_agent",
      "output_summary": "approved \u2014 no issues found",
      "timestamp": "2026-09-09T17:03:02.916930+00:00",
      "success": true
    }
  ],
  "code_diff": "--- /dev/null\n+++ b/hi.py\n@@ -0,0 +1,1 @@\n+print(\"hi\")\n",
  "test_results": {
    "passed": true,
    "criteria_matched": [
      "Creates file named hi.py in current directory.",
      "File contains valid Python syntax without errors.",
      "Executing file outputs exactly 'hi'.",
      "All existing tests still pass"
    ],
    "failures": []
  },
  "review_result": {
    "passed": true,
    "findings": []
  },
  "retry_count": 0,
  "consensus_report": {
    "consensus_score_pct": 97.1,
    "confidence_level": "HIGH_CONFIDENCE",
    "sub_scores": {
      "pm_architect_alignment": 98.0,
      "architect_coding_alignment": 96.5,
      "testing_alignment": 95.0,
      "review_rigor": 99.0
    },
    "is_unanimous": true
  }
}