{
  "task_id": "task_81af92",
  "feature_request": "in test.py clear the file and add 2 classes, one of vehicle(with string and license plate) where the car inherits vehicle, 3 instances and print the info",
  "acceptance_criteria": [],
  "scoped_files": [],
  "status": "blocked",
  "current_agent": "manager_agent",
  "plan": null,
  "history": [
    {
      "agent": "pm_agent",
      "output_summary": "runtime error: Groq API call failed: Error code: 429 - {'error': {'message': 'Rate limit reached for model `qwen/qwen3.8-27b` in organi",
      "timestamp": "2026-09-08T09:24:39.572625+00:00",
      "success": false
    }
  ],
  "code_diff": null,
  "test_results": null,
  "review_result": null,
  "retry_count": 0,
  "consensus_report": {
    "consensus_score_pct": 83.8,
    "confidence_level": "MODERATE_CONFIDENCE",
    "sub_scores": {
      "pm_architect_alignment": 85.0,
      "architect_coding_alignment": 80.0,
      "testing_alignment": 90.0,
      "review_rigor": 80.0
    },
    "is_unanimous": false
  }
}