{
  "task_id": "live_722",
  "feature_request": "in test.py add a function for printing the first 10 fibonacci numbers",
  "acceptance_criteria": [
    "The test.py file contains a function that, when called, returns or prints exactly the first 10 numbers of the Fibonacci sequence starting with 0 and 1",
    "The output of the function matches the sequence [0, 1, 1, 2, 3, 5, 8, 13, 21, 34] exactly in order",
    "Calling the function does not modify any external state or database records",
    "All existing tests still pass"
  ],
  "scoped_files": [],
  "status": "blocked",
  "current_agent": "manager_agent",
  "plan": null,
  "history": [
    {
      "agent": "pm_agent",
      "output_summary": "acceptance criteria defined (4 criteria)",
      "timestamp": "2026-09-08T08:55:24.697847+00:00",
      "success": true
    },
    {
      "agent": "architect_agent",
      "output_summary": "runtime error: Groq API call failed: Error code: 429 - {'error': {'message': 'Rate limit reached for model `qwen/qwen3.8-27b` in organi",
      "timestamp": "2026-09-08T08:55:25.236850+00:00",
      "success": false
    }
  ],
  "code_diff": null,
  "test_results": null,
  "review_result": null,
  "retry_count": 0,
  "consensus_report": {
    "consensus_score_pct": 72.5,
    "confidence_level": "REQUIRES_ATTENTION",
    "sub_scores": {
      "pm_architect_alignment": 40.0,
      "architect_coding_alignment": 80.0,
      "testing_alignment": 90.0,
      "review_rigor": 80.0
    },
    "is_unanimous": false
  }
}