{
  "task_id": "task_99a785",
  "feature_request": "Create a testing.py to create 2 classes shape(input is a string) and rectangle(2 integers, length and breadth), which inherits shape and prints the area, then runs the method, after creating a object of that class,  where the shape name and area are printed for a 6x14 rectangle",
  "acceptance_criteria": [
    "The file testing.py defines a base class 'shape' that accepts a string argument upon initialization",
    "The file testing.py defines a 'rectangle' class that inherits from 'shape', accepts two integer arguments for length and breadth, and prints the area of the rectangle",
    "Executing the script testing.py with a 6x14 rectangle instance outputs the string 'Rectangle' and the integer '84' representing the area",
    "All existing tests still pass"
  ],
  "scoped_files": [],
  "status": "blocked",
  "current_agent": "human",
  "plan": null,
  "history": [
    {
      "agent": "pm_agent",
      "output_summary": "acceptance criteria defined (4 criteria)",
      "timestamp": "2026-09-08T07:37:58.899747+00:00",
      "success": true
    },
    {
      "agent": "architect_agent",
      "output_summary": "architect_agent error: Architect output validation failed: NEW FILE 'testing.py' already exists on disk \u2014 remove the NEW FILE: marker",
      "timestamp": "2026-09-08T07:38:53.880868+00:00",
      "success": false
    }
  ],
  "code_diff": null,
  "test_results": null,
  "review_result": null,
  "retry_count": 0,
  "consensus_report": {
    "consensus_score_pct": 72.5,
    "confidence_level": "REQUIRES_ATTENTION",
    "sub_scores": {
      "pm_architect_alignment": 40.0,
      "architect_coding_alignment": 80.0,
      "testing_alignment": 90.0,
      "review_rigor": 80.0
    },
    "is_unanimous": false
  }
}