{
  "task_id": "task_7697d9",
  "feature_request": "Modify only train.py. Add a print statement that prints a random integer from 1 to 10.",
  "acceptance_criteria": [],
  "scoped_files": [],
  "status": "blocked",
  "current_agent": "pm_agent",
  "plan": null,
  "history": [
    {
      "agent": "pm_agent",
      "output_summary": "blocked: Feature cannot be implemented within the FlaskBB domain.",
      "timestamp": "2026-09-04T15:23:26.825955+00:00",
      "success": false
    }
  ],
  "code_diff": null,
  "test_results": null,
  "review_result": null,
  "retry_count": 0,
  "consensus_report": {
    "consensus_score_pct": 83.8,
    "confidence_level": "MODERATE_CONFIDENCE",
    "sub_scores": {
      "pm_architect_alignment": 85.0,
      "architect_coding_alignment": 80.0,
      "testing_alignment": 90.0,
      "review_rigor": 80.0
    },
    "is_unanimous": false
  }
}